{
  "$ref": "#/definitions/settings",
  "definitions": {
    "settings": {
      "type": "object",
      "properties": {
        "logoText": {
          "type": "string"
        },
        "links": {
          "type": "array",
          "items": {
            "type": "object",
            "properties": {
              "label": {
                "type": "string"
              },
              "href": {
                "type": "string"
              }
            },
            "required": [
              "label",
              "href"
            ],
            "additionalProperties": false
          }
        },
        "ctaLabel": {
          "type": "string"
        },
        "ctaHref": {
          "type": "string"
        },
        "$schema": {
          "type": "string"
        }
      },
      "additionalProperties": false
    }
  },
  "$schema": "http://json-schema.org/draft-07/schema#"
}