{
  "logoText": "OnlineTranslation.ae",
  "links": [
    { "label": "Home", "href": "/" },
    { "label": "Services", "href": "/services/" },
    { "label": "Legal Translation", "href": "/services/legal-translation/" },
    { "label": "Certificates", "href": "/services/certificate-translation/" },
    { "label": "Pricing", "href": "/resources/pricing-guide/" },
    { "label": "About", "href": "/about/" },
    { "label": "Contact", "href": "/contact/" }
  ],
  "ctaLabel": "WhatsApp your documents",
  "ctaHref": "https://wa.me/971508620217"
}
